{
  "schema": "ferris.profile-evidence/v0",
  "profile_id": "fixture.browser-wasm",
  "revision": "r1",
  "consumer": "fixture.browser-wasm.consumer",
  "sections": {
    "identity": {"family": "browser_wasm"},
    "closure": {},
    "features": {},
    "toolchain": {},
    "targets": {"wasm32-unknown-unknown": {"runtime": "BROWSER-WASM-RAW-BEFORE"}},
    "providers": {},
    "native": {},
    "stages": {},
    "assurance": {},
    "stewardship": {},
    "support": {},
    "lifecycle": {}
  }
}
