{
  "schema": "ferris.profile-evidence/v0",
  "profile_id": "!",
  "revision": "!",
  "consumer": "!",
  "sections": {
    "identity": {
      "!": null
    },
    "closure": null,
    "features": null,
    "toolchain": null,
    "targets": null,
    "providers": null,
    "native": null,
    "stages": null,
    "assurance": null,
    "stewardship": null,
    "support": null,
    "lifecycle": null
  }
}
