{
  "schema": "ferris.profile-evidence/v0",
  "profile_id": "fixture.pure-data",
  "revision": "r2",
  "consumer": "fixture.pure-data.consumer",
  "sections": {
    "identity": {"family": "pure_data"},
    "closure": {"active": {"digest": "PURE-DATA-RAW-AFTER"}},
    "features": {},
    "toolchain": {},
    "targets": {},
    "providers": {},
    "native": {},
    "stages": {},
    "assurance": {},
    "stewardship": {},
    "support": {},
    "lifecycle": {}
  }
}
